{
  "pipeline": "default",
  "comment": "Teams simple bot create package: pure render. The require-empty-target step guards the create contract so render writes the selected language subtree without post-render injection.",
  "render": {
    "filters": [
      {
        "comment": "Sandbox files are opt-in.",
        "when": "!featureFlag('TEAMSFX_SANDBOXED_TEAM')",
        "exclude": [
          "m365agents.sandbox.yml",
          "teamsapp.sandbox.yml",
          "env/.env.sandbox",
          "env/.env.sandbox.user"
        ]
      }
    ]
  },
  "steps": [
    {
      "step": "require-empty-target"
    }
  ]
}
